<?xml version="1.0"?>
<!DOCTYPE Report
[
<!ELEMENT Report (General ,(Doc|BPT)) >
<!ATTLIST Report ver CDATA #REQUIRED tmZone CDATA #REQUIRED>

<!ELEMENT General ( DocLocation ) >
<!ATTLIST General productName CDATA #REQUIRED productVer CDATA #REQUIRED os CDATA #REQUIRED host CDATA #REQUIRED qcserver CDATA #IMPLIED qcproject CDATA #IMPLIED SolManSolutionId CDATA #IMPLIED SolManProjectId CDATA #IMPLIED SolManTestPlanId CDATA #IMPLIED SolManTestPackageId CDATA #IMPLIED SolManUserInfoData CDATA #IMPLIED  >

<!ELEMENT BPT (DName,Res,DVer?,TSet?,TInst?,NodeArgs,AdditionalInfo*,Doc*) >
<!ATTLIST BPT rID ID #REQUIRED >

<!ELEMENT Doc (DName,ConfName?,Res,DVer?,TSet?,TInst?,RunType?,DT?,AdditionalInfo*,Step*,DIter*,Step*,Action*,Doc*,Summary?,TestMaintenanceSummary*,NodeArgs?) >
<!ATTLIST Doc rID ID #REQUIRED type (Test|BC|BPTWrapperTest|Flow|Group|Action) "Test" productName CDATA #REQUIRED BCIter CDATA #IMPLIED >

<!ELEMENT RunType ( #PCDATA )>
<!ATTLIST RunType fmStep (False|True) "False" batch (False|True) "False" upDesc (False|True) "False" upChk (False|True) "False" upAS (False|True) "False">

<!ELEMENT DName ( #PCDATA ) >

<!ELEMENT ConfName ( #PCDATA ) >

<!ELEMENT Res ( #PCDATA ) >

<!ELEMENT AdditionalInfo (AdditionalDataName,AdditionalDataValue ) >

<!ELEMENT AdditionalDataName ( #PCDATA ) >

<!ELEMENT AdditionalDataValue ( #PCDATA ) >

<!ELEMENT DVer ( #PCDATA ) >

<!ELEMENT TSet ( #PCDATA ) >

<!ELEMENT TInst ( #PCDATA ) >

<!ELEMENT DIter (Step*,Action+,Summary?,NodeArgs)>
<!ATTLIST DIter rID ID #REQUIRED iterID CDATA #REQUIRED>

<!ELEMENT DocLocation ( #PCDATA )>

<!ELEMENT Action (AName,AIter*,(Step|HtmlStep|Action)*, Summary,ActionMaintenanceSummary*, NodeArgs ) >
<!ATTLIST Action rID ID #REQUIRED>

<!ELEMENT AIter ((Step|HtmlStep|Action)*,DataMapping?, Summary?,NodeArgs) >
<!ATTLIST AIter rID ID #REQUIRED iterID CDATA #REQUIRED isCountable (False|True) "False" >

<!ELEMENT AName ( #PCDATA ) >

<!ELEMENT TestMaintenanceSummary (ActionMaintenanceSummary*) >
<!ATTLIST TestMaintenanceSummary ObjectsAdded CDATA #REQUIRED ObjectsUpdated CDATA #REQUIRED StepsUpdated CDATA #REQUIRED StepsComments CDATA #REQUIRED><!ELEMENT ActionMaintenanceSummary (ObjectChange* ) >
<!ATTLIST ActionMaintenanceSummary Action CDATA #REQUIRED Objects CDATA #REQUIRED Updated CDATA #REQUIRED LinesTotal CDATA #REQUIRED Added CDATA #REQUIRED LinesUpdated CDATA #REQUIRED>

<!ELEMENT ObjectChange  (Hierarchy, PropertyChangeList* ) >
<!ATTLIST ObjectChange Operation CDATA #IMPLIED OriginalRepository CDATA #IMPLIED>

<!ELEMENT PropertyChangeList (PropertyDef*) >

<!ELEMENT PropertyDef (OriginalValue, NewValue) >
<!ATTLIST PropertyDef PropName CDATA #REQUIRED OriginRegularExpression (True|False) "False" NewRegularExpression (True|False) "False" AddedProperty (True|False) "False" >

<!ELEMENT OriginalValue ( #PCDATA )>

<!ELEMENT NewValue ( #PCDATA )>

<!ELEMENT Hierarchy  (ObjectName, Hierarchy*) >
<!ATTLIST Hierarchy MicClass CDATA #REQUIRED>

<!ELEMENT ObjectName  ( #PCDATA ) >

<!ELEMENT Step (Obj,Details,Time,TimeTick* ,(Step|HtmlStep|Doc)*, DataMapping?, NodeArgs) >
<!ATTLIST Step rID ID #REQUIRED retval CDATA #IMPLIED>

<!ELEMENT HtmlStep (HTML,TimeTick*,(Step|HtmlStep|Doc)*,NodeArgs) >
<!ATTLIST HtmlStep rID ID #REQUIRED >

<!ELEMENT Obj ( #PCDATA ) >
<!ATTLIST Obj plainTxt (False|True) "True">

<!ELEMENT Details ( #PCDATA ) >
<!ATTLIST Details plainTxt (False|True) "True">

<!ELEMENT Time ( #PCDATA ) >

<!ELEMENT HTML ( #PCDATA ) >

<!ELEMENT Disp ( #PCDATA ) >

<!ELEMENT TimeTick ( #PCDATA ) >

<!ELEMENT DataMapping ( DataMappedItem* )>
<!ELEMENT DataMappedItem EMPTY >
<!ATTLIST DataMappedItem dsName CDATA #REQUIRED >
<!ATTLIST DataMappedItem rowId CDATA #REQUIRED >

<!ELEMENT NodeArgs (Disp,TopPane?,BtmPane?,ExtendedInfo? )>
<!ATTLIST NodeArgs eType CDATA #REQUIRED icon CDATA #REQUIRED nRep CDATA #REQUIRED UserNote CDATA #IMPLIED filter (False|True) "True">
<!ATTLIST NodeArgs status (Passed|Failed|Done|Warning|Information) "Done">
<!ATTLIST NodeArgs iconSel CDATA #IMPLIED nType CDATA #IMPLIED MovieMarker CDATA "">
<!ATTLIST NodeArgs Source CDATA #IMPLIED SourceLine CDATA #IMPLIED StepFlowItemKey CDATA #IMPLIED >

<!ELEMENT TopPane (Path)>

<!ELEMENT BtmPane ( (Path|WR)?,ASHilite?)>
<!ATTLIST BtmPane vType CDATA "HTML">

<!ELEMENT Path ( #PCDATA ) >

<!ELEMENT ASHilite ( #PCDATA ) >

<!ELEMENT WR ( #PCDATA ) >

<!ELEMENT ExtendedInfo ( StepData ) >

<!ATTLIST ExtendedInfo StepType CDATA #REQUIRED>
<!ELEMENT DT (NodeArgs) >
<!ATTLIST DT rID ID #REQUIRED>

<!ELEMENT Summary (Param*)>
<!ATTLIST Summary sTime CDATA #IMPLIED eTime CDATA #IMPLIED passed CDATA #IMPLIED failed CDATA #IMPLIED warnings CDATA #IMPLIED retval CDATA #IMPLIED stopped (False|True) "False" >

<!ELEMENT Param (ParamName,ParamVal)+ >
<!ATTLIST Param paramInOut (In|Out) "In">

<!ELEMENT ParamName ( #PCDATA ) >

<!ELEMENT ParamVal ( #PCDATA ) >

]
>
<Report ver="2.0" tmZone="India Standard Time">
<General productName="HP Unified Functional Testing" productVer="12.02" os="Windows 7" host="GREGORYJ01"><DocLocation><![CDATA[D:\PROJECT_FOLDER\Testscripts\LabTask]]></DocLocation></General>
<Doc rID="T1"   productName= "HP Unified Functional Testing"  >
<DName><![CDATA[LabTask]]></DName>
<Res><![CDATA[Res3]]></Res>
<DT rID="T2">
<NodeArgs eType="Table" icon="2" nRep="4" filter="False" >
<Disp><![CDATA[Run-Time Data Table]]></Disp>
<BtmPane vType="Table" >
<Path><![CDATA[Default.xls]]></Path>
</BtmPane>
</NodeArgs>
</DT>
<DIter rID="T3" iterID="1" >
<Action rID="T4">
<AName><![CDATA[Action1]]></AName>
<Step rID="T5">
<Obj plainTxt="False" ><![CDATA[LoadFunctionLibrary]]></Obj>
<Details plainTxt="False" ><![CDATA[LoadFunctionLibrary function passed]]></Details>
<Time><![CDATA[12/7/2015 - 19:40:04]]></Time>
<TimeTick>1449497404</TimeTick>
<NodeArgs eType="Replay" icon="5" nRep="8" status="Passed" Source="Action1" SourceLine="21" >
<Disp><![CDATA[LoadFunctionLibrary]]></Disp>
</NodeArgs>
</Step>
<Step rID="T6">
<Obj plainTxt="False" ><![CDATA[LoadFunctionLibrary]]></Obj>
<Details plainTxt="False" ><![CDATA[LoadFunctionLibrary function passed]]></Details>
<Time><![CDATA[12/7/2015 - 19:40:04]]></Time>
<TimeTick>1449497404</TimeTick>
<NodeArgs eType="Replay" icon="5" nRep="9" status="Passed" Source="Action1" SourceLine="21" >
<Disp><![CDATA[LoadFunctionLibrary]]></Disp>
</NodeArgs>
</Step>
<Step rID="T7">
<Obj plainTxt="False" ><![CDATA[LoadFunctionLibrary]]></Obj>
<Details plainTxt="False" ><![CDATA[LoadFunctionLibrary function passed]]></Details>
<Time><![CDATA[12/7/2015 - 19:40:04]]></Time>
<TimeTick>1449497404</TimeTick>
<NodeArgs eType="Replay" icon="5" nRep="10" status="Passed" Source="Action1" SourceLine="21" >
<Disp><![CDATA[LoadFunctionLibrary]]></Disp>
</NodeArgs>
</Step>
<Step rID="T8">
<Obj plainTxt="False" ><![CDATA[LoadFunctionLibrary]]></Obj>
<Details plainTxt="False" ><![CDATA[LoadFunctionLibrary function passed]]></Details>
<Time><![CDATA[12/7/2015 - 19:40:04]]></Time>
<TimeTick>1449497404</TimeTick>
<NodeArgs eType="Replay" icon="5" nRep="11" status="Passed" Source="Action1" SourceLine="45" >
<Disp><![CDATA[LoadFunctionLibrary]]></Disp>
</NodeArgs>
</Step>
<Step rID="T9">
<Obj plainTxt="False" ><![CDATA[[ WebEdit ].Set]]></Obj>
<Details plainTxt="False" ><![CDATA["155889"]]></Details>
<Time><![CDATA[12/7/2015 - 19:40:05]]></Time>
<TimeTick>1449497405</TimeTick>
<NodeArgs eType="Replay" icon="6" nRep="14" >
<Disp><![CDATA[[ WebEdit ].Set]]></Disp>
</NodeArgs>
</Step>
<Step rID="T10">
<Obj plainTxt="False" ><![CDATA[[ icon_vh_search ].Click]]></Obj>
<Details plainTxt="False" ><![CDATA[]]></Details>
<Time><![CDATA[12/7/2015 - 19:40:06]]></Time>
<TimeTick>1449497406</TimeTick>
<NodeArgs eType="Replay" icon="7" nRep="17" >
<Disp><![CDATA[[ icon_vh_search ].Click]]></Disp>
</NodeArgs>
</Step>
<Step rID="T11">
<Obj plainTxt="False" ><![CDATA[[ Patient Search Results   ].Exist]]></Obj>
<Details plainTxt="False" ><![CDATA["Object exists"]]></Details>
<Time><![CDATA[12/7/2015 - 19:40:11]]></Time>
<TimeTick>1449497411</TimeTick>
<NodeArgs eType="Replay" icon="8" nRep="21" >
<Disp><![CDATA[[ Patient Search Results   ].Exist]]></Disp>
</NodeArgs>
</Step>
<Step rID="T12">
<Obj plainTxt="False" ><![CDATA[[  Cancel ].Exist]]></Obj>
<Details plainTxt="False" ><![CDATA["Object exists"]]></Details>
<Time><![CDATA[12/7/2015 - 19:40:11]]></Time>
<TimeTick>1449497411</TimeTick>
<NodeArgs eType="Replay" icon="9" nRep="24" >
<Disp><![CDATA[[  Cancel ].Exist]]></Disp>
</NodeArgs>
</Step>
<Step rID="T13">
<Obj plainTxt="False" ><![CDATA[[  Cancel ].Click]]></Obj>
<Details plainTxt="False" ><![CDATA[]]></Details>
<Time><![CDATA[12/7/2015 - 19:40:11]]></Time>
<TimeTick>1449497411</TimeTick>
<NodeArgs eType="Replay" icon="9" nRep="26" >
<Disp><![CDATA[[  Cancel ].Click]]></Disp>
</NodeArgs>
</Step>
<Step rID="T14">
<Obj plainTxt="False" ><![CDATA[[ icon_vh_switchUser ].Exist]]></Obj>
<Details plainTxt="False" ><![CDATA["Object exists"]]></Details>
<Time><![CDATA[12/7/2015 - 19:40:13]]></Time>
<TimeTick>1449497413</TimeTick>
<NodeArgs eType="Replay" icon="7" nRep="28" >
<Disp><![CDATA[[ icon_vh_switchUser ].Exist]]></Disp>
</NodeArgs>
</Step>
<Step rID="T15">
<Obj plainTxt="False" ><![CDATA[[ icon_vh_switchUser ].Exist]]></Obj>
<Details plainTxt="False" ><![CDATA["Object exists"]]></Details>
<Time><![CDATA[12/7/2015 - 19:40:13]]></Time>
<TimeTick>1449497413</TimeTick>
<NodeArgs eType="Replay" icon="7" nRep="29" >
<Disp><![CDATA[[ icon_vh_switchUser ].Exist]]></Disp>
</NodeArgs>
</Step>
<Step rID="T16">
<Obj plainTxt="False" ><![CDATA[[ icon_vh_switchUser ].Click]]></Obj>
<Details plainTxt="False" ><![CDATA[]]></Details>
<Time><![CDATA[12/7/2015 - 19:40:13]]></Time>
<TimeTick>1449497413</TimeTick>
<NodeArgs eType="Replay" icon="7" nRep="31" >
<Disp><![CDATA[[ icon_vh_switchUser ].Click]]></Disp>
</NodeArgs>
</Step>
<Step rID="T17">
<Obj plainTxt="False" ><![CDATA[[ My Roster ].Exist]]></Obj>
<Details plainTxt="False" ><![CDATA["Object exists"]]></Details>
<Time><![CDATA[12/7/2015 - 19:40:16]]></Time>
<TimeTick>1449497416</TimeTick>
<NodeArgs eType="Replay" icon="9" nRep="33" >
<Disp><![CDATA[[ My Roster ].Exist]]></Disp>
</NodeArgs>
</Step>
<Step rID="T18">
<Obj plainTxt="False" ><![CDATA[[ My Roster ].Exist]]></Obj>
<Details plainTxt="False" ><![CDATA["Object exists"]]></Details>
<Time><![CDATA[12/7/2015 - 19:40:16]]></Time>
<TimeTick>1449497416</TimeTick>
<NodeArgs eType="Replay" icon="9" nRep="34" >
<Disp><![CDATA[[ My Roster ].Exist]]></Disp>
</NodeArgs>
</Step>
<Step rID="T19">
<Obj plainTxt="False" ><![CDATA[[ My Roster ].Click]]></Obj>
<Details plainTxt="False" ><![CDATA[]]></Details>
<Time><![CDATA[12/7/2015 - 19:40:16]]></Time>
<TimeTick>1449497416</TimeTick>
<NodeArgs eType="Replay" icon="9" nRep="36" >
<Disp><![CDATA[[ My Roster ].Click]]></Disp>
</NodeArgs>
</Step>
<Step rID="T20">
<Obj plainTxt="False" ><![CDATA[[ icon_vh_switchUser ].Exist]]></Obj>
<Details plainTxt="False" ><![CDATA["Object exists"]]></Details>
<Time><![CDATA[12/7/2015 - 19:40:22]]></Time>
<TimeTick>1449497422</TimeTick>
<NodeArgs eType="Replay" icon="7" nRep="39" >
<Disp><![CDATA[[ icon_vh_switchUser ].Exist]]></Disp>
</NodeArgs>
</Step>
<Step rID="T21">
<Obj plainTxt="False" ><![CDATA[[ icon_vh_switchUser ].Exist]]></Obj>
<Details plainTxt="False" ><![CDATA["Object exists"]]></Details>
<Time><![CDATA[12/7/2015 - 19:40:22]]></Time>
<TimeTick>1449497422</TimeTick>
<NodeArgs eType="Replay" icon="7" nRep="41" >
<Disp><![CDATA[[ icon_vh_switchUser ].Exist]]></Disp>
</NodeArgs>
</Step>
<Step rID="T22">
<Obj plainTxt="False" ><![CDATA[[ icon_vh_switchUser ].Click]]></Obj>
<Details plainTxt="False" ><![CDATA[]]></Details>
<Time><![CDATA[12/7/2015 - 19:40:22]]></Time>
<TimeTick>1449497422</TimeTick>
<NodeArgs eType="Replay" icon="7" nRep="43" >
<Disp><![CDATA[[ icon_vh_switchUser ].Click]]></Disp>
</NodeArgs>
</Step>
<Step rID="T23">
<Obj plainTxt="False" ><![CDATA["[ AARTI PATEL ]":Function Call]]></Obj>
<Details plainTxt="False" ><![CDATA[RowCount]]></Details>
<Time><![CDATA[12/7/2015 - 19:40:30]]></Time>
<TimeTick>1449497430</TimeTick>
<NodeArgs eType="General" icon="10" nRep="46" >
<Disp><![CDATA["[ AARTI PATEL ]":Function Call]]></Disp>
</NodeArgs>
</Step>
<Step rID="T24">
<Obj plainTxt="False" ><![CDATA["[ AARTI PATEL ]":Function Call]]></Obj>
<Details plainTxt="False" ><![CDATA[ChildItem]]></Details>
<Time><![CDATA[12/7/2015 - 19:40:30]]></Time>
<TimeTick>1449497430</TimeTick>
<NodeArgs eType="General" icon="10" nRep="47" >
<Disp><![CDATA["[ AARTI PATEL ]":Function Call]]></Disp>
</NodeArgs>
</Step>
<Step rID="T25">
<Obj plainTxt="False" ><![CDATA["[ AARTI PATEL ]":Function Call]]></Obj>
<Details plainTxt="False" ><![CDATA[ChildItem]]></Details>
<Time><![CDATA[12/7/2015 - 19:40:30]]></Time>
<TimeTick>1449497430</TimeTick>
<NodeArgs eType="General" icon="10" nRep="48" >
<Disp><![CDATA["[ AARTI PATEL ]":Function Call]]></Disp>
</NodeArgs>
</Step>
<Step rID="T26">
<Obj plainTxt="False" ><![CDATA["[ AARTI PATEL ]":Function Call]]></Obj>
<Details plainTxt="False" ><![CDATA[ChildItem]]></Details>
<Time><![CDATA[12/7/2015 - 19:40:30]]></Time>
<TimeTick>1449497430</TimeTick>
<NodeArgs eType="General" icon="10" nRep="49" >
<Disp><![CDATA["[ AARTI PATEL ]":Function Call]]></Disp>
</NodeArgs>
</Step>
<Step rID="T27">
<Obj plainTxt="False" ><![CDATA["[ AARTI PATEL ]":Function Call]]></Obj>
<Details plainTxt="False" ><![CDATA[ChildItem]]></Details>
<Time><![CDATA[12/7/2015 - 19:40:30]]></Time>
<TimeTick>1449497430</TimeTick>
<NodeArgs eType="General" icon="10" nRep="50" >
<Disp><![CDATA["[ AARTI PATEL ]":Function Call]]></Disp>
</NodeArgs>
</Step>
<Step rID="T28">
<Obj plainTxt="False" ><![CDATA["[ AARTI PATEL ]":Function Call]]></Obj>
<Details plainTxt="False" ><![CDATA[ChildItem]]></Details>
<Time><![CDATA[12/7/2015 - 19:40:30]]></Time>
<TimeTick>1449497430</TimeTick>
<NodeArgs eType="General" icon="10" nRep="51" >
<Disp><![CDATA["[ AARTI PATEL ]":Function Call]]></Disp>
</NodeArgs>
</Step>
<Step rID="T29">
<Obj plainTxt="False" ><![CDATA["[ AARTI PATEL ]":Function Call]]></Obj>
<Details plainTxt="False" ><![CDATA[ChildItem]]></Details>
<Time><![CDATA[12/7/2015 - 19:40:30]]></Time>
<TimeTick>1449497430</TimeTick>
<NodeArgs eType="General" icon="10" nRep="52" >
<Disp><![CDATA["[ AARTI PATEL ]":Function Call]]></Disp>
</NodeArgs>
</Step>
<Step rID="T30">
<Obj plainTxt="False" ><![CDATA["[ AARTI PATEL ]":Function Call]]></Obj>
<Details plainTxt="False" ><![CDATA[ChildItem]]></Details>
<Time><![CDATA[12/7/2015 - 19:40:30]]></Time>
<TimeTick>1449497430</TimeTick>
<NodeArgs eType="General" icon="10" nRep="53" >
<Disp><![CDATA["[ AARTI PATEL ]":Function Call]]></Disp>
</NodeArgs>
</Step>
<Step rID="T31">
<Obj plainTxt="False" ><![CDATA["[ AARTI PATEL ]":Function Call]]></Obj>
<Details plainTxt="False" ><![CDATA[ChildItem]]></Details>
<Time><![CDATA[12/7/2015 - 19:40:30]]></Time>
<TimeTick>1449497430</TimeTick>
<NodeArgs eType="General" icon="10" nRep="54" >
<Disp><![CDATA["[ AARTI PATEL ]":Function Call]]></Disp>
</NodeArgs>
</Step>
<Step rID="T32">
<Obj plainTxt="False" ><![CDATA["[ AARTI PATEL ]":Function Call]]></Obj>
<Details plainTxt="False" ><![CDATA[ChildItem]]></Details>
<Time><![CDATA[12/7/2015 - 19:40:30]]></Time>
<TimeTick>1449497430</TimeTick>
<NodeArgs eType="General" icon="10" nRep="55" >
<Disp><![CDATA["[ AARTI PATEL ]":Function Call]]></Disp>
</NodeArgs>
</Step>
<Step rID="T33">
<Obj plainTxt="False" ><![CDATA["[ AARTI PATEL ]":Function Call]]></Obj>
<Details plainTxt="False" ><![CDATA[ChildItem]]></Details>
<Time><![CDATA[12/7/2015 - 19:40:30]]></Time>
<TimeTick>1449497430</TimeTick>
<NodeArgs eType="General" icon="10" nRep="56" >
<Disp><![CDATA["[ AARTI PATEL ]":Function Call]]></Disp>
</NodeArgs>
</Step>
<Step rID="T34">
<Obj plainTxt="False" ><![CDATA["[ AARTI PATEL ]":Function Call]]></Obj>
<Details plainTxt="False" ><![CDATA[ChildItem]]></Details>
<Time><![CDATA[12/7/2015 - 19:40:30]]></Time>
<TimeTick>1449497430</TimeTick>
<NodeArgs eType="General" icon="10" nRep="57" >
<Disp><![CDATA["[ AARTI PATEL ]":Function Call]]></Disp>
</NodeArgs>
</Step>
<Step rID="T35">
<Obj plainTxt="False" ><![CDATA["[ AARTI PATEL ]":Function Call]]></Obj>
<Details plainTxt="False" ><![CDATA[ChildItem]]></Details>
<Time><![CDATA[12/7/2015 - 19:40:30]]></Time>
<TimeTick>1449497430</TimeTick>
<NodeArgs eType="General" icon="10" nRep="58" >
<Disp><![CDATA["[ AARTI PATEL ]":Function Call]]></Disp>
</NodeArgs>
</Step>
<Step rID="T36">
<Obj plainTxt="False" ><![CDATA["[ AARTI PATEL ]":Function Call]]></Obj>
<Details plainTxt="False" ><![CDATA[ChildItem]]></Details>
<Time><![CDATA[12/7/2015 - 19:40:30]]></Time>
<TimeTick>1449497430</TimeTick>
<NodeArgs eType="General" icon="10" nRep="59" >
<Disp><![CDATA["[ AARTI PATEL ]":Function Call]]></Disp>
</NodeArgs>
</Step>
<Step rID="T37">
<Obj plainTxt="False" ><![CDATA["[ AARTI PATEL ]":Function Call]]></Obj>
<Details plainTxt="False" ><![CDATA[ChildItem]]></Details>
<Time><![CDATA[12/7/2015 - 19:40:30]]></Time>
<TimeTick>1449497430</TimeTick>
<NodeArgs eType="General" icon="10" nRep="60" >
<Disp><![CDATA["[ AARTI PATEL ]":Function Call]]></Disp>
</NodeArgs>
</Step>
<Step rID="T38">
<Obj plainTxt="False" ><![CDATA["[ AARTI PATEL ]":Function Call]]></Obj>
<Details plainTxt="False" ><![CDATA[ChildItem]]></Details>
<Time><![CDATA[12/7/2015 - 19:40:30]]></Time>
<TimeTick>1449497430</TimeTick>
<NodeArgs eType="General" icon="10" nRep="61" >
<Disp><![CDATA["[ AARTI PATEL ]":Function Call]]></Disp>
</NodeArgs>
</Step>
<Step rID="T39">
<Obj plainTxt="False" ><![CDATA["[ AARTI PATEL ]":Function Call]]></Obj>
<Details plainTxt="False" ><![CDATA[ChildItem]]></Details>
<Time><![CDATA[12/7/2015 - 19:40:30]]></Time>
<TimeTick>1449497430</TimeTick>
<NodeArgs eType="General" icon="10" nRep="62" >
<Disp><![CDATA["[ AARTI PATEL ]":Function Call]]></Disp>
</NodeArgs>
</Step>
<Step rID="T40">
<Obj plainTxt="False" ><![CDATA["[ AARTI PATEL ]":Function Call]]></Obj>
<Details plainTxt="False" ><![CDATA[ChildItem]]></Details>
<Time><![CDATA[12/7/2015 - 19:40:30]]></Time>
<TimeTick>1449497430</TimeTick>
<NodeArgs eType="General" icon="10" nRep="63" >
<Disp><![CDATA["[ AARTI PATEL ]":Function Call]]></Disp>
</NodeArgs>
</Step>
<Step rID="T41">
<Obj plainTxt="False" ><![CDATA["[ AARTI PATEL ]":Function Call]]></Obj>
<Details plainTxt="False" ><![CDATA[ChildItem]]></Details>
<Time><![CDATA[12/7/2015 - 19:40:30]]></Time>
<TimeTick>1449497430</TimeTick>
<NodeArgs eType="General" icon="10" nRep="64" >
<Disp><![CDATA["[ AARTI PATEL ]":Function Call]]></Disp>
</NodeArgs>
</Step>
<Step rID="T42">
<Obj plainTxt="False" ><![CDATA["[ AARTI PATEL ]":Function Call]]></Obj>
<Details plainTxt="False" ><![CDATA[ChildItem]]></Details>
<Time><![CDATA[12/7/2015 - 19:40:30]]></Time>
<TimeTick>1449497430</TimeTick>
<NodeArgs eType="General" icon="10" nRep="65" >
<Disp><![CDATA["[ AARTI PATEL ]":Function Call]]></Disp>
</NodeArgs>
</Step>
<Step rID="T43">
<Obj plainTxt="False" ><![CDATA["[ AARTI PATEL ]":Function Call]]></Obj>
<Details plainTxt="False" ><![CDATA[ChildItem]]></Details>
<Time><![CDATA[12/7/2015 - 19:40:30]]></Time>
<TimeTick>1449497430</TimeTick>
<NodeArgs eType="General" icon="10" nRep="66" >
<Disp><![CDATA["[ AARTI PATEL ]":Function Call]]></Disp>
</NodeArgs>
</Step>
<Step rID="T44">
<Obj plainTxt="False" ><![CDATA["[ AARTI PATEL ]":Function Call]]></Obj>
<Details plainTxt="False" ><![CDATA[ChildItem]]></Details>
<Time><![CDATA[12/7/2015 - 19:40:30]]></Time>
<TimeTick>1449497430</TimeTick>
<NodeArgs eType="General" icon="10" nRep="67" >
<Disp><![CDATA["[ AARTI PATEL ]":Function Call]]></Disp>
</NodeArgs>
</Step>
<Step rID="T45">
<Obj plainTxt="False" ><![CDATA["[ AARTI PATEL ]":Function Call]]></Obj>
<Details plainTxt="False" ><![CDATA[ChildItem]]></Details>
<Time><![CDATA[12/7/2015 - 19:40:30]]></Time>
<TimeTick>1449497430</TimeTick>
<NodeArgs eType="General" icon="10" nRep="68" >
<Disp><![CDATA["[ AARTI PATEL ]":Function Call]]></Disp>
</NodeArgs>
</Step>
<Step rID="T46">
<Obj plainTxt="False" ><![CDATA["[ AARTI PATEL ]":Function Call]]></Obj>
<Details plainTxt="False" ><![CDATA[ChildItem]]></Details>
<Time><![CDATA[12/7/2015 - 19:40:30]]></Time>
<TimeTick>1449497430</TimeTick>
<NodeArgs eType="General" icon="10" nRep="69" >
<Disp><![CDATA["[ AARTI PATEL ]":Function Call]]></Disp>
</NodeArgs>
</Step>
<Step rID="T47">
<Obj plainTxt="False" ><![CDATA["[ AARTI PATEL ]":Function Call]]></Obj>
<Details plainTxt="False" ><![CDATA[ChildItem]]></Details>
<Time><![CDATA[12/7/2015 - 19:40:30]]></Time>
<TimeTick>1449497430</TimeTick>
<NodeArgs eType="General" icon="10" nRep="70" >
<Disp><![CDATA["[ AARTI PATEL ]":Function Call]]></Disp>
</NodeArgs>
</Step>
<Step rID="T48">
<Obj plainTxt="False" ><![CDATA["[ AARTI PATEL ]":Function Call]]></Obj>
<Details plainTxt="False" ><![CDATA[ChildItem]]></Details>
<Time><![CDATA[12/7/2015 - 19:40:30]]></Time>
<TimeTick>1449497430</TimeTick>
<NodeArgs eType="General" icon="10" nRep="71" >
<Disp><![CDATA["[ AARTI PATEL ]":Function Call]]></Disp>
</NodeArgs>
</Step>
<Step rID="T49">
<Obj plainTxt="False" ><![CDATA["[ AARTI PATEL ]":Function Call]]></Obj>
<Details plainTxt="False" ><![CDATA[ChildItem]]></Details>
<Time><![CDATA[12/7/2015 - 19:40:30]]></Time>
<TimeTick>1449497430</TimeTick>
<NodeArgs eType="General" icon="10" nRep="72" >
<Disp><![CDATA["[ AARTI PATEL ]":Function Call]]></Disp>
</NodeArgs>
</Step>
<Step rID="T50">
<Obj plainTxt="False" ><![CDATA["[ AARTI PATEL ]":Function Call]]></Obj>
<Details plainTxt="False" ><![CDATA[ChildItem]]></Details>
<Time><![CDATA[12/7/2015 - 19:40:30]]></Time>
<TimeTick>1449497430</TimeTick>
<NodeArgs eType="General" icon="10" nRep="73" >
<Disp><![CDATA["[ AARTI PATEL ]":Function Call]]></Disp>
</NodeArgs>
</Step>
<Step rID="T51">
<Obj plainTxt="False" ><![CDATA["[ AARTI PATEL ]":Function Call]]></Obj>
<Details plainTxt="False" ><![CDATA[ChildItem]]></Details>
<Time><![CDATA[12/7/2015 - 19:40:30]]></Time>
<TimeTick>1449497430</TimeTick>
<NodeArgs eType="General" icon="10" nRep="74" >
<Disp><![CDATA["[ AARTI PATEL ]":Function Call]]></Disp>
</NodeArgs>
</Step>
<Step rID="T52">
<Obj plainTxt="False" ><![CDATA["[ AARTI PATEL ]":Function Call]]></Obj>
<Details plainTxt="False" ><![CDATA[ChildItem]]></Details>
<Time><![CDATA[12/7/2015 - 19:40:30]]></Time>
<TimeTick>1449497430</TimeTick>
<NodeArgs eType="General" icon="10" nRep="75" >
<Disp><![CDATA["[ AARTI PATEL ]":Function Call]]></Disp>
</NodeArgs>
</Step>
<Step rID="T53">
<Obj plainTxt="False" ><![CDATA["[ AARTI PATEL ]":Function Call]]></Obj>
<Details plainTxt="False" ><![CDATA[ChildItem]]></Details>
<Time><![CDATA[12/7/2015 - 19:40:30]]></Time>
<TimeTick>1449497430</TimeTick>
<NodeArgs eType="General" icon="10" nRep="76" >
<Disp><![CDATA["[ AARTI PATEL ]":Function Call]]></Disp>
</NodeArgs>
</Step>
<Step rID="T54">
<Obj plainTxt="False" ><![CDATA["[ AARTI PATEL ]":Function Call]]></Obj>
<Details plainTxt="False" ><![CDATA[ChildItem]]></Details>
<Time><![CDATA[12/7/2015 - 19:40:30]]></Time>
<TimeTick>1449497430</TimeTick>
<NodeArgs eType="General" icon="10" nRep="77" >
<Disp><![CDATA["[ AARTI PATEL ]":Function Call]]></Disp>
</NodeArgs>
</Step>
<Step rID="T55">
<Obj plainTxt="False" ><![CDATA["[ AARTI PATEL ]":Function Call]]></Obj>
<Details plainTxt="False" ><![CDATA[ChildItem]]></Details>
<Time><![CDATA[12/7/2015 - 19:40:30]]></Time>
<TimeTick>1449497430</TimeTick>
<NodeArgs eType="General" icon="10" nRep="78" >
<Disp><![CDATA["[ AARTI PATEL ]":Function Call]]></Disp>
</NodeArgs>
</Step>
<Step rID="T56">
<Obj plainTxt="False" ><![CDATA["[ AARTI PATEL ]":Function Call]]></Obj>
<Details plainTxt="False" ><![CDATA[ChildItem]]></Details>
<Time><![CDATA[12/7/2015 - 19:40:30]]></Time>
<TimeTick>1449497430</TimeTick>
<NodeArgs eType="General" icon="10" nRep="79" >
<Disp><![CDATA["[ AARTI PATEL ]":Function Call]]></Disp>
</NodeArgs>
</Step>
<Step rID="T57">
<Obj plainTxt="False" ><![CDATA["[ AARTI PATEL ]":Function Call]]></Obj>
<Details plainTxt="False" ><![CDATA[ChildItem]]></Details>
<Time><![CDATA[12/7/2015 - 19:40:30]]></Time>
<TimeTick>1449497430</TimeTick>
<NodeArgs eType="General" icon="10" nRep="80" >
<Disp><![CDATA["[ AARTI PATEL ]":Function Call]]></Disp>
</NodeArgs>
</Step>
<Step rID="T58">
<Obj plainTxt="False" ><![CDATA["[ AARTI PATEL ]":Function Call]]></Obj>
<Details plainTxt="False" ><![CDATA[ChildItem]]></Details>
<Time><![CDATA[12/7/2015 - 19:40:30]]></Time>
<TimeTick>1449497430</TimeTick>
<NodeArgs eType="General" icon="10" nRep="81" >
<Disp><![CDATA["[ AARTI PATEL ]":Function Call]]></Disp>
</NodeArgs>
</Step>
<Step rID="T59">
<Obj plainTxt="False" ><![CDATA["[ AARTI PATEL ]":Function Call]]></Obj>
<Details plainTxt="False" ><![CDATA[ChildItem]]></Details>
<Time><![CDATA[12/7/2015 - 19:40:30]]></Time>
<TimeTick>1449497430</TimeTick>
<NodeArgs eType="General" icon="10" nRep="82" >
<Disp><![CDATA["[ AARTI PATEL ]":Function Call]]></Disp>
</NodeArgs>
</Step>
<Step rID="T60">
<Obj plainTxt="False" ><![CDATA["[ AARTI PATEL ]":Function Call]]></Obj>
<Details plainTxt="False" ><![CDATA[ChildItem]]></Details>
<Time><![CDATA[12/7/2015 - 19:40:30]]></Time>
<TimeTick>1449497430</TimeTick>
<NodeArgs eType="General" icon="10" nRep="83" >
<Disp><![CDATA["[ AARTI PATEL ]":Function Call]]></Disp>
</NodeArgs>
</Step>
<Step rID="T61">
<Obj plainTxt="False" ><![CDATA["[ AARTI PATEL ]":Function Call]]></Obj>
<Details plainTxt="False" ><![CDATA[ChildItem]]></Details>
<Time><![CDATA[12/7/2015 - 19:40:30]]></Time>
<TimeTick>1449497430</TimeTick>
<NodeArgs eType="General" icon="10" nRep="84" >
<Disp><![CDATA["[ AARTI PATEL ]":Function Call]]></Disp>
</NodeArgs>
</Step>
<Step rID="T62">
<Obj plainTxt="False" ><![CDATA["[ AARTI PATEL ]":Function Call]]></Obj>
<Details plainTxt="False" ><![CDATA[ChildItem]]></Details>
<Time><![CDATA[12/7/2015 - 19:40:30]]></Time>
<TimeTick>1449497430</TimeTick>
<NodeArgs eType="General" icon="10" nRep="85" >
<Disp><![CDATA["[ AARTI PATEL ]":Function Call]]></Disp>
</NodeArgs>
</Step>
<Step rID="T63">
<Obj plainTxt="False" ><![CDATA["[ AARTI PATEL ]":Function Call]]></Obj>
<Details plainTxt="False" ><![CDATA[ChildItem]]></Details>
<Time><![CDATA[12/7/2015 - 19:40:30]]></Time>
<TimeTick>1449497430</TimeTick>
<NodeArgs eType="General" icon="10" nRep="86" >
<Disp><![CDATA["[ AARTI PATEL ]":Function Call]]></Disp>
</NodeArgs>
</Step>
<Step rID="T64">
<Obj plainTxt="False" ><![CDATA["[ AARTI PATEL ]":Function Call]]></Obj>
<Details plainTxt="False" ><![CDATA[ChildItem]]></Details>
<Time><![CDATA[12/7/2015 - 19:40:30]]></Time>
<TimeTick>1449497430</TimeTick>
<NodeArgs eType="General" icon="10" nRep="87" >
<Disp><![CDATA["[ AARTI PATEL ]":Function Call]]></Disp>
</NodeArgs>
</Step>
<Step rID="T65">
<Obj plainTxt="False" ><![CDATA["[ AARTI PATEL ]":Function Call]]></Obj>
<Details plainTxt="False" ><![CDATA[ChildItem]]></Details>
<Time><![CDATA[12/7/2015 - 19:40:30]]></Time>
<TimeTick>1449497430</TimeTick>
<NodeArgs eType="General" icon="10" nRep="88" >
<Disp><![CDATA["[ AARTI PATEL ]":Function Call]]></Disp>
</NodeArgs>
</Step>
<Step rID="T66">
<Obj plainTxt="False" ><![CDATA["[ AARTI PATEL ]":Function Call]]></Obj>
<Details plainTxt="False" ><![CDATA[ChildItem]]></Details>
<Time><![CDATA[12/7/2015 - 19:40:30]]></Time>
<TimeTick>1449497430</TimeTick>
<NodeArgs eType="General" icon="10" nRep="89" >
<Disp><![CDATA["[ AARTI PATEL ]":Function Call]]></Disp>
</NodeArgs>
</Step>
<Step rID="T67">
<Obj plainTxt="False" ><![CDATA["[ AARTI PATEL ]":Function Call]]></Obj>
<Details plainTxt="False" ><![CDATA[ChildItem]]></Details>
<Time><![CDATA[12/7/2015 - 19:40:30]]></Time>
<TimeTick>1449497430</TimeTick>
<NodeArgs eType="General" icon="10" nRep="90" >
<Disp><![CDATA["[ AARTI PATEL ]":Function Call]]></Disp>
</NodeArgs>
</Step>
<Step rID="T68">
<Obj plainTxt="False" ><![CDATA["[ AARTI PATEL ]":Function Call]]></Obj>
<Details plainTxt="False" ><![CDATA[ChildItem]]></Details>
<Time><![CDATA[12/7/2015 - 19:40:30]]></Time>
<TimeTick>1449497430</TimeTick>
<NodeArgs eType="General" icon="10" nRep="91" >
<Disp><![CDATA["[ AARTI PATEL ]":Function Call]]></Disp>
</NodeArgs>
</Step>
<Step rID="T69">
<Obj plainTxt="False" ><![CDATA["[ AARTI PATEL ]":Function Call]]></Obj>
<Details plainTxt="False" ><![CDATA[ChildItem]]></Details>
<Time><![CDATA[12/7/2015 - 19:40:30]]></Time>
<TimeTick>1449497430</TimeTick>
<NodeArgs eType="General" icon="10" nRep="92" >
<Disp><![CDATA["[ AARTI PATEL ]":Function Call]]></Disp>
</NodeArgs>
</Step>
<Step rID="T70">
<Obj plainTxt="False" ><![CDATA["[ AARTI PATEL ]":Function Call]]></Obj>
<Details plainTxt="False" ><![CDATA[ChildItem]]></Details>
<Time><![CDATA[12/7/2015 - 19:40:30]]></Time>
<TimeTick>1449497430</TimeTick>
<NodeArgs eType="General" icon="10" nRep="93" >
<Disp><![CDATA["[ AARTI PATEL ]":Function Call]]></Disp>
</NodeArgs>
</Step>
<Step rID="T71">
<Obj plainTxt="False" ><![CDATA["[ AARTI PATEL ]":Function Call]]></Obj>
<Details plainTxt="False" ><![CDATA[ChildItem]]></Details>
<Time><![CDATA[12/7/2015 - 19:40:30]]></Time>
<TimeTick>1449497430</TimeTick>
<NodeArgs eType="General" icon="10" nRep="94" >
<Disp><![CDATA["[ AARTI PATEL ]":Function Call]]></Disp>
</NodeArgs>
</Step>
<Step rID="T72">
<Obj plainTxt="False" ><![CDATA["[ AARTI PATEL ]":Function Call]]></Obj>
<Details plainTxt="False" ><![CDATA[ChildItem]]></Details>
<Time><![CDATA[12/7/2015 - 19:40:30]]></Time>
<TimeTick>1449497430</TimeTick>
<NodeArgs eType="General" icon="10" nRep="95" >
<Disp><![CDATA["[ AARTI PATEL ]":Function Call]]></Disp>
</NodeArgs>
</Step>
<Step rID="T73">
<Obj plainTxt="False" ><![CDATA["[ AARTI PATEL ]":Function Call]]></Obj>
<Details plainTxt="False" ><![CDATA[ChildItem]]></Details>
<Time><![CDATA[12/7/2015 - 19:40:30]]></Time>
<TimeTick>1449497430</TimeTick>
<NodeArgs eType="General" icon="10" nRep="96" >
<Disp><![CDATA["[ AARTI PATEL ]":Function Call]]></Disp>
</NodeArgs>
</Step>
<Step rID="T74">
<Obj plainTxt="False" ><![CDATA["[ AARTI PATEL ]":Function Call]]></Obj>
<Details plainTxt="False" ><![CDATA[ChildItem]]></Details>
<Time><![CDATA[12/7/2015 - 19:40:30]]></Time>